URL,Tennis
http://www.soonersports.com/ViewArticle.dbml?DB_OEM_ID=31000&ATCLID=211800773,"The No. 25 Oklahoma men’s tennis team’s run at the Big 12 Championship came to an end Saturday with a 4-2 loss to No. 2 Texas in the semifinals. 

OU (15-10, 2-5 Big 12) tallied singles wins from Jake Van Emburgh and Alex Bakshi, but fell short to the Longhorns.  

“Today we had our chances to take the match,” said OU head coach Nick Crowell. “We played good doubles again and put ourselves right there in position, we just need to do a few things better and we will get that point next time. 

Our goal is to keep getting better moving forward into NCAAs. This team has a lot of heart and resiliency and I’m excited to get back on the courts these next two weeks and get back to work.” 

In doubles, Van Emburgh and Ferran Calvo came away with a win on court two, but the Sooners dropped the opening point. Van Emburgh and Calvo took down Colin Markes and Leonardo Telles 6-3. After tying the match at every game up to 3-all, the Sooners won the next three games, sealed by a Van Emburgh service winner, to capture court two. 

No. 53 Bakshi and Stefano Tsorotiotis fell to No. 6 Harrison Scott and Christian Sigsgaard 6-3 on court one. At the No. 3 line, Max Stewart and Spencer Papa were defeated by Chih Chi Huang and Yuya Ito 7-5. 

In singles, No. 63 Bakshi pulled off an upset at the two spot, taking down No. 7 Ito in straight sets. After trailing early in the first, Bakshi rallied to take the set 6-4, then carried his momentum into the second where he never trailed to win 6-3.  

“Alex got a huge win for the Sooners. His opponent is so tough and Alex showed what he can do when he is playing his game,” said Crowell.  

No. 80 Van Emburgh routed No. 73 Telles on court two. The sophomore jumped out to a 3-0 lead in the first set before closing it out 6-4. Van Emburgh trailed 2-1 to start the second but took control and allowed Telles just one more game to win 6-3. 

“Jake stepped up again and showed why he is one of the toughest competitors in the nation. His opponent is a senior with a lot of experience and Jake really took it to him. “ 

No. 36 Papa fell to No. 9 Sigsgaard 6-4, 6-3 on court one. Beiler was defeated by Markes 6-4, 6-3 at the No. 5 line. On court six, Tsorotiotis fell to Rodrigo Banzer 6-2, 6-1.  

When play was halted, Calvo was headed to a third set with No. 53 Scott on court three. Calvo took the first set 6-4 before Scott claimed set two 6-3. 

The Sooners await their NCAA fate, with selections announced April 29. The first and second rounds of the tournament will be held May 3-5 at campus sites. "
https://www.usopen.org/en_US/news/articles/2019-04-12/hot_shots_tsongas_stretching_family_tiafoes_offcourt_visit.html?chip=2,"Welcome to this week's edition of ""Hot Shots,"" a USOpen.org-curated look at what you may have missed on social media over the past seven days. This week on tennis Twitter, Jo-Wilfried Tsonga shares a snap of his team, Frances Tiafoe makes an off-court appearance, and Eugenie Bouchard snaps back with the truth.

Tennis Twitter is a place where hot shots, amazing aces and the tennis community can come together and connect. It is also a place where rumors are quick to run rampant. And this week they have, when a Twitter account falsely reported that Genie Bouchard, who recently pulled out of two tournaments, was taking “an indeterminate break.”

Bouchard, who has a strong social media presence, shut down the rumors quickly.


Another player who isn’t taking a break is three-time US Open quarterfinalist Jo-Wilfried Tsonga. On Thursday, the Frenchman shared a snap of him and his son, Sugar, stretching before hitting the courts in Marrakech, Morocco.


While Tsonga has advanced to the quarterfinals, Madison Keys made it all the way to the winner’s circle this past Sunday, taking her fourth title in Charleston after defeating Caroline Wozniacki, 7-6, 6-3, at the Volvo Car Open.


World No. 479 Tara Moore of Great Britain had a huge win of her own earlier this week, as the 26-year-old showed her perseverance and tenacity at a Futures event in her home country. Just one point away from losing, 6-0, 6-0, Moore pulled off an amazing comeback, battling back to beat Jessika Ponchet, 0-6, 7-6, 6-3. "
https://www.thesun.co.uk/sport/tennis/8904912/watch-as-andy-murray-returns-to-tennis-court-in-bid-for-incredible-wimbledon-comeback-following-hip-operation/,"The two-time Wimbo champ, 32 next month, is shown digging out a backhand slice and firing over some relaxed forehand top-spins in his biggest hint yet of a serious return.

LTA coach Matt James tweeted the clip from an outside green clay court and added: ""He’s back....ish #murray"".Scot Murray can be seen knocking up with Estonia's world No 15 Anett Kontavei and Britain's Canadian-born starlet Emma Raducanu, 16.

And the big question is whether former world No1 Murray is still pain free.

Just last week he revealed he had played his first round of golf without discomfort for six years.

That suggested his recovery from hip resurfacing surgery in January and April - following persistent injury problems in recent years - is going as smoothly as possible.

Murray will surely take huge encouragement from USA doubles expert Bob Bryan, 40, successfully returning from the same operation.

And tennis fans tweeted their delight at Murray's Wimbo outing today, one saying: ""Seeing Andy pain free and hitting a tennis ball is so blooming good to see.""

Murray himself said last month: “I want to continue playing.

“I said that in Australia. The issue is I don’t know if it’s possible."
https://www.apnews.com/31d99e8cef724fa395233613bfdb643c,"LONDON (AP) — Brazilian tennis player Joao Souza has been provisionally suspended again amid a corruption investigation by the Tennis Integrity Unit.

Souza had already been provisionally suspended on March 29 but was reinstated on April 8 following a successful appeal.

The TIU says that the provisional suspension has been put back in place “following consideration of additional evidence submitted by the TIU,” adding that no more appeals will be accepted.

No further details were given for the reason of the suspension. Also in 2015, Souza played in the longest Davis Cup singles match ever, losing to Leonardo Mayer of Argentina 15-13 in the fifth set after 6 hours, 42 minutes.

The TIU is a joint initiative of the Grand Slam Board, the International Tennis Federation and the ATP and the WTA tours.

The 30-year old Souza is currently ranked No. 422, having reached a career-high of No. 69 in 2015."
https://www.crackedracquets.com/cracked-interviews-hiltzik-190416/,"Welcome back Cracked fans to another edition of the Cracked Interviews Podcast. On today’s episode, former University of Illinois All-American and current ATP #381 Jared Hiltzik joins Host Alex Gruskin to discuss his relationship with the game of tennis.The guys start by discussing how Jared got involved with the sport, and how having a younger brother who also excelled helped facilitate his own development. Jared also shares how his relationships with coaches Billy Heiser and Brad Dancer shaped the type of player he has become, and why he believes every tennis player would benefit from at least one year in college.

The two also reflect on Jared’s recent media tour, and comment on the many flaws of the new ITF Transition Tour. They also run through some Jared’s highlights at Illinois, and end with a Rapid Fire segment touching on Jared’s NY Giants fandom, favorite meal, and so much more."
http://lynnfightingknights.com/sports/mten/2018-19/releases/20190403mimspf,"empe, Ariz. – Despite a loss last week, Lynn University's men's tennis team moved up one spot from No. 9 to No. 8 with the latest release of the Oracle/ITA National Rankings on Wednesday.

The Fighting Knights suffered just their second loss of the season last week, falling to No. 1 Barry, 5-2, before bouncing back with a 7-0 triumph over No. 33 Florida Southern. The Blue and White claim a 10-2 record on the year so far with a 5-1 mark in Sunshine State Conference play.

Out of the SSC, Barry (No. 1) and Saint Leo (No. 4) remain ahead of Lynn, with Rollins (No. 12) and Palm Beach Atlantic (No. 15) not far behind.

Kay Bartmann makes his return to the singles national rankings at No. 56 following a huge upset over then-No. 3 Pierre Montrieul of Barry last week. Florian Clemares also returns to the rankings, coming in at No. 70.

Bartmann and Clemares continue to climb up the ranks in the doubles poll as the tandem moves up 26 positions to No. 24."
https://www.belmontbruins.com/sports/m-tennis/2018-19/releases/20190405kkhwga,"NASHVILLE, Tenn.– The Belmont men's tennis team defeated Eastern Illinois University 4-1, at the Nashboro Village Tennis Courts Friday afternoon. 

The Bruins grabbed an early 1-0 lead after taking the doubles point with wins at No. 1 and No. 2 doubles. At the top, Marko Ilic and Joan Valy defeated Mike Jansen and Gertjan De Wilder 6-1 while at the second Hendrik Inno and Zak Khan defeated Gage Kingsmith and Daniel Hernandez 6-2.  

In singles, Belmont took wins at the No. 2, No. 3 and No. 4 clinching the win for the Bruins. At the two, Ilic defeated Kingsmith 6-1, 3-6, 6-1; Valy defeated Hernandez 6-1, 6-4 at No. 3 and Khan won 6-3, 6-2 against De Wilder.  The match ended early due to time. 

The Bruins move up to a 2-1 record in conference play. 

Up next, for the Bruins is a home match against Tennessee State University.  The match is set for April 13 at 1 p.m. 

Belmont 4, Eastern Illinois 1
 
Singles competition
1. O'BRIEN, Freddie (EIU) def. Hendrik Inno (BELM) 6-1, 6-3
2. Marko Ilic (BELM) def. KINGSMITH, Gage (EIU) 6-1, 3-6, 6-1
3. Joan Valy (BELM) def. HERNANDEZ, Daniel (EIU) 6-3, 6-4
4. Zak Khan (BELM) def. DE WILDER, Gertjan (EIU) 6-3, 6-1
5. Vincent Sterkens (BELM) vs. CHARBONNEAU, Logan (EIU) 4-1, unfinished
6. Jake Briggs (BELM) vs. KNIELING, Luka (EIU) 5-2, unfinished
 
Doubles competition
1. Marko Ilic/Joan Valy (BELM) def. JANSEN, Mike/DE WILDER, Gertjan (EIU) 6-1
2. Hendrik Inno/Zak Khan (BELM) def. KINGSMITH, Gage/HERNANDEZ, Daniel (EIU) 6-2
3. Grant Kelly/Vincent Sterkens (BELM) vs. O'BRIEN, Freddie/CHARBONNEAU, Logan (EIU) 5-4, unfinished
 
Match Notes:
Eastern Illinois 11-13, 0-3
Belmont 10-9, 2-1"
https://southerncaliforniatennis.org/youth-tennis/qualifier-hohmann-repeat-winner-navarro-win-adidas-easter-bowl-titles/,"A qualifier winning his ninth match in nine days and a repeat Adidas Easter Bowl winner highlighted the final day of action at the 52nd annual Adidas Easter Bowl on Sunday at the Indian Wells Tennis Garden.

LSU recruit and Ron Hohmann of Oyster Bay, N.Y., became the first qualifier in Easter Bowl history to run through the entire draw and end it with a title as the 17-year-old beat No. 3-seeded Martin Damm, 4-6, 6-2, 6-4, to capture the USTA Gold ball in the Boys’ ITF 18-and-under division at the USTA Spring Nationals.

Charleston, S.C., 17-year-old Emma Navarro added a second USTA Gold Ball to her vast collection as she added the singles title to the doubles she won Saturday in taking out 14-year-old No. 14 seeded Robin Montgomery of Washington D.C., 6-0, 7-6 (2), for the Girls’ ITF 18s title. Navarro became the eighth girls in Easter Bowl history to win the Girls’ 16s, then come back to also win the 18s.Hohmann receives three valuable wild cards into future events, including one into this home-state US Open Juniors in September.

“I didn’t really think if I win, I get this, if I lose I get this,” said Hohmann, who will also get wild cards into an ATP $80,000 Challenger and a ITF World Tennis Tour $25,000 event. “During the match I had no thought about it. Maybe on match point I did. Match point I was thinking about it a little bit.”

In the third set, and receiving serve up 3-2, Damm couldn’t convert on two breaks points as Hohmann found a way to hold for 3-all. Damm said there wasn’t much he could do as Hohmann never stopped hitting out and going for winners.

“Those winners were coming left and right and there is really nothing you could do about that,” said Damm, who won the 16s at the USTA National Hardcourts in Kalamazoo, Mich., last year. “He played a really good match, and I didn’t play my best match. I think he was just playing free. He was making winners from every part of the court. There were so many things I could have done differently but it’s already in the past and there will be other matches and I look forward to my next one on Tuesday [in Carson].”

Damm received the USTA Silver ball and will also get wild cards into a $25,000 and $15,000 ITF pro event.

Hohmann said he wasn’t sure how his body would hold up. He signaled for his coach who joined him on the courts at the end of the second set. “I literally told him I’m so tired and I can’t move and he told me the game plan of what to do and he told me to be consistent and don’t waste your energy on stupid things,” Hohmann said. “I just conserved my energy very well.”

Hohmann was able to handle the 6-foot-6 ½ Damm’s lefty serve when he needed to most. “Every time I broke him I made sure to get the serve in the court, but he has a great serve,” he said. “It was really tough to return.”

After dominating an overwhelmed Montgomery to win the first set at love, Navarro found herself down 2-5 in the second before playing her consistent, steady game to come back and force a tiebreaker. She had won two tiebreakers at 7-1 earlier in the tournament and dominated the final one starting the breaker with an ace.

“I’m trying to figure out why I’m doing so good in tiebreakers,” said Navarro, who has a wild card into singles and doubles on clay at her hometown WTA Premier Level Volvo Car Open this week. “I focus well in tiebreakers and I know it’s high stakes and it’s important and it matters.”"
http://www.espn.com/tennis/story/_/id/26560445/souza-suspended-amid-corruption-investigation,"LONDON -- Brazilian tennis player Joao Souza has been provisionally suspended again amid a corruption investigation by the Tennis Integrity Unit.

Souza had already been provisionally suspended on March 29 but was reinstated on April 8 following a successful appeal.

The TIU says that the provisional suspension has been put back in place ""following consideration of additional evidence submitted by the TIU,"" adding that no more appeals will be accepted.


No further details were given on the reason for the suspension.

The 30-year-old Souza is ranked No. 422, having reached a career-high of No. 69 in 2015.

Also in 2015, Souza played in the longest Davis Cup singles match ever, losing to Leonardo Mayer of Argentina 15-13 in the fifth set after 6 hours, 42 minutes.

The TIU is a joint initiative of the Grand Slam Board, the International Tennis Federation and the ATP and the WTA tours."
http://springfieldcollegepride.com/sports/wten/2018-19/releases/20190325n0zfp8,"Springfield, Mass. - March 25, 2019 - Honored for their impressive play over Spring Break, Springfield College's Emily Etter (Guilford, Conn.), Cara Freadman (Richmond, Mass.) and Rielly Malz (Glastonbury, Conn.) were all honored with New England Women's and Men's Athletic Conference (NEWMAC) weekly honors, which was announced on Monday afternoon.

Etter, a senior Physician Assistant major at Springfield College, was named the NEWMAC Women's Tennis Singles Athlete of the Week, while Freadman, a junior Health Science major, and Malz, a freshman Physician Assistant major, were named the NEWMAC Women's Tennis Doubles Team of the Week.  Winning six of their first seven matches of the season, Springfield is off to its best start since the 1996 squad opened up with a 7-1 record. 

Etter won all four of her singles bouts, dropping just four games the entire week, as the Pride went 3-1 in their Spring Break trip to Florida. The senior also won all three of her doubles outings and helped Springfield start their 2018-19 campaign winning their first five matches.

Competing at the No. 2 doubles spot for Springfield in Florida last week, the team of Malz and Freadman were outstanding, winning all four of their matches to help Springfield earn three team victories.

For the latest on Springfield College Athletics, follow the Pride on social media on Twitter, Facebook and Instagram. Fans can also download the Springfield ""Front Row"" mobile app, powered by PrestoSports, on iTunes and the Android Market."
https://wwos.nine.com.au/tennis/nick-kyrgios-miami-open-umpire-rant-tony-jones-says-should-be-banned/1d43ae6d-e2d8-4274-a69d-7ed91ae11d26,"Nick Kyrgios is a ""foul-mouthed little brat"" who should be banned for three months over a shocking meltdown at the Miami Open, says veteran Channel Nine sports presenter Tony Jones.

Kyrgios was playing a doubles match alongside American Taylor Fritz in Miami on Sunday (AEDT), with the pair defeated 10-8 in a super tiebreaker by Portugal’s Joao Sousa and Argentina's Guido Pella.

Kyrgios was reportedly unhappy with a number of calls during the match and he exploded at the umpire after the final point.

""What the f--- is wrong with you? You're a disgrace. Absolute f---ing disgrace,"" Kyrgios yelled at the umpire, before smashing his racquet and continuing his rant in the direction of fans. The rant stunned even hardened tennis followers, who have seen plenty of volatile behaviour from Kyrgios during his young career.

Jones unloaded on Kyrgios on the TODAY Show, saying the 23-year-old Aussie needed to be sidelined by the ATP Tour.

""Really ugly stuff again from Kyrgios,"" Jones said.

""It just begs so many questions on so many fronts. Why is it that tennis is probably the only sport in the world where the participants can freely abuse the umpires and get off scot free? We've seen it for decades now and it continues to happen.

""And as for Kyrgios, I mean, how many second chances do you give this kid? When the summer was on and we had him in the commentary box for Channel Nine, butter wouldn't melt in his mouth.

""But bottom line is, he's a foul-mouthed little brat and I just think, no more second chances. He should be banned for three months on the back of that."""
https://www.yenisafak.com/en/sports/tennis-messi-backing-pique-in-new-davis-cup-venture-3474681,"Lionel Messi is one of the investors in the Davis Cup Finals in Madrid later this year, according to Barcelona team mate Gerard Pique whose Kosmos company has been instrumental in a revamp for the historic tennis competition.

Pique's investment firm Kosmos has backed the new format to the tune of $3 billion over 25 years and will jointly run the competition alongside the International Tennis Federation (ITF).

The inaugural 18-nation finals, which have replaced the 16-nation World Group played throughout the year, will take place at Madrid's La Caja Magica (Magic Box) stadium on Nov. 18-24.

Speaking before Thursday's draw ceremony, Pique confirmed Argentina forward and fellow tennis fan Messi, who already has a stake in Kosmos, was involved.

""Leo knows more than anyone about this because he is involved in Kosmos,"" Pique was quoted as saying by British media on Friday.

""He is a partner, he is part of the Kosmos family, he likes tennis. We have a relationship of 18 years since he arrived at the club and I always try to share with him things I'm thinking, he loves to be part of it and he wanted to be part of it.""

Pique's involvement in the ITF's 119-year-old team competition has drawn scorn in some quarters, with former world number one Lleyton Hewitt, who will captain Australia at the event, questioning his credentials.

Swiss great Roger Federer even suggested the competition was in danger of becoming the ""Pique Cup"".

""I hate it, because it's not about me and I don't want my name on the competition,"" Pique said.

""Davis Cup history is so big. I hope we can change this opinion. After a few years, I hope they go back and say 'We were wrong, Davis Cup is more alive than ever'.

""I respect the opinion of Lleyton, he was a great player. I can understand that when a footballer comes in the tennis world it can seem a little bit awkward or strange, but at the end of the day I'm not going to be changing the rules of tennis.""

Pique, 32, also said he was too busy trying to help Barcelona win La Liga and the Champions League than meddling too much in the ITF's flagship tournament.

""I don't want to be distracted because I have another job, which is to play football. It helps me be focused, more concentrated and not to make mistakes on the pitch because otherwise I know there will be criticism,"" he said in the Daily Mail.

The Davis Cup Finals, which will offer a large prize money pot, will be staged in Madrid for two years before possibly moving to the California resort of Indian Wells owned by another Kosmos stakeholder Larry Ellison"
https://www.swuathletics.com/sports/mten/2018-19/releases/20190411xotrb8,"Belmont, NC – Southern Wesleyan fell to the Belmont Abbey Crusaders in a 7-0 final on Thursday afternoon.

 

Game Vitals

Final: Belmont Abbey 7, Southern Wesleyan 0

Records: Southern Wesleyan (3-13 / CC 0-8) Belmont Abbey (11-12 / CC 5-2)

 

Coach Thompson Says...

""Our team competed hard in this loss. As a whole it has been a challenging season, but the players who are here are doing the right things to improve and give themselves the best chance to win. I am excited for the future of SWU Tennis!""

 

How It Happened

The Warriors went 1-1 in doubles action. Peter Kovats and Sarvesh Maria defeated Zachary Blythe and Henrique Leal in a 6-2 final. Joseph Olatunji and Ben Smith fell to Holden Ballard and Kent Shiell in a 6-3 final.

In singles action, the Warriors went 0-4 on Thursday afternoon. Peter Kovats fell to Zachary Blythe in a 6-1 and 6-4 final. Sarvesh Maria fell to George Barfoot in a 6-4 and 6-1 final. Joseph Olatunji fell to Kent Shiell in 6-2 and 6-1 final scores and Ben Smith fell to Christopher Hansen in 6-1 and 6-1 final scores."
https://www.smh.com.au/sport/tennis/stosur-to-launch-fed-cup-campaign-against-belarus-20190419-p51fli.html,"So good for so long away from home, Samantha Stosur has been offered a chance to star in Australia after receiving a surprise Fed Cup semi-final singles call-up.

The former world No.4 has won a US Open and made three semis and a final at the French Open but never gone beyond the fourth round in her home grand slam.Success at the Brisbane International has also escaped her but, at 35, the Gold Coast talent has another opportunity to make some happy memories on Brisbane’s Pat Rafter Arena.

Stosur was picked ahead of Daria Gavrilova and Priscilla Hon and will play world No.10 Aryna Sabalenka in Australia’s opening rubber against Belarus on Saturday.Australian spearhead and world No.9 Ashleigh Barty has drawn doubles partner and two-time Australian Open winner Victoria Azarenka in a tasty first day of action.

The Queensland duo are also set to play doubles together for the first time in what could be a deciding fifth rubber on Sunday.

If Australia wins they will host the final in November against Romania or France and chase their first Fed Cup title since Evonne Goolagong Cawley starred in 1974.

The Belarusian camp admitted their surprise when Stosur’s name was called at Friday’s draw announcement but Australian captain Alicia Molik said it made sense.

‘‘It’s a player Sam’s really familiar with and that’s really important in tie like this, one where no doubt experience has to count as well,’’ Molik said.

‘‘It’d be incredible if I saw her on the weekend get the best out of herself.

‘‘She’s achieved so much and more than most in her career and you talk about longevity and professionalism - you’ve got your No.1 person sitting right here.

‘‘[It’d be great] if Sam can enjoy some of those spoils and gets return for those efforts.’’

Stosur admitted home summers had rarely been kind to her in a 20-year career but that she couldn’t be thinking like that this weekend.

‘‘It’d be fantastic to win tomorrow, first for my team and second for myself,’’ said Stosur, who has won more Fed Cup singles matches (29) than any other Australian.

‘‘It’s always been a bit of a challenge playing in Pat Rafter Arena, but there’s some very good players I’ve played against too.

‘‘I’m not looking in the past of what has or hasn’t happened; it’s all about what I am going to be able to do tomorrow.’’"
